<?xml version="1.0" encoding="UTF-8"?>
<!-- Odkaz na projekt uložený na GitHub: https://github.com/KajuskaCZ/konfiguraceHernihoSveta -->
<konfigurace_oblasti xmlns:xsi="http://www.w3.org/2001/XMLSchema-instance" xsi:noNamespaceSchemaLocation="pikorova_karolina.xsd">
    <obecne_nastaveni>
        <max_pocet_oblasti>7</max_pocet_oblasti>
        <celkova_rozloha>9200</celkova_rozloha>
        <zvyrazneni_hranic>false</zvyrazneni_hranic>
    </obecne_nastaveni>
    <oblasti>
        <oblast id="1" o_nazev="Staré město">
            <nastaveni>
                <filtr>žádný</filtr>
                <viditelnost>50</viditelnost>
                <pocasi obloha="mraky">polojasno</pocasi>
                <rozloha>800</rozloha>
                <hudba_playlist>8</hudba_playlist>
                <voda>
                    <odstin>1</odstin>
                    <odraz>false</odraz>
                    <kvalita>střední</kvalita>
                </voda>
            </nastaveni>
            <urovne>
                <min_uroven>1</min_uroven>
                <min_uroven_nepratel>1</min_uroven_nepratel>
                <max_uroven_nepratel>10</max_uroven_nepratel>
            </urovne>
            <frakce_v_oblasti>
                <frakce f_nazev="Železní">
                    <reputace body_na_zacatek="0">přátelé</reputace>
                    <zamereni>obecné</zamereni>
                    <interaktivni_postavy>
                        <interaktivni_postava id="5" jmeno="Zeus">
                            <moznost_zabit>false</moznost_zabit>
                            <ukoly>
                                <ukol id="1" u_nazev="Zlatý prsten">
                                    <popis>Ve staré truhle v mém dřívějším domově jsem zapomněl svůj drahocený prsten. Přines mi ho a dám Ti odměnu.</popis>
                                    <odmena>Mědený prsten</odmena>
                                </ukol>
                                <ukol id="2" u_nazev="Kovář">
                                    <popis>Mým společníkem, jak jsi již jistě zjistil, je kovář Serpis. Poptej se ho na nejlepší zbroje v kraji.</popis>
                                    <odmena>Železné kalhoty s vyrytým znakem</odmena>
                                </ukol>
                                <ukol id="3" u_nazev="Polévka">
                                    <popis>Přines pět prasečích ocásků.</popis>
                                    <odmena>Vepřová polévka</odmena>
                                </ukol>
                            </ukoly>
                        </interaktivni_postava>
                    </interaktivni_postavy>
                </frakce>
            </frakce_v_oblasti>
            <skupiny_nepratel>
                <skupina_nepratel n_nazev="Jezdci">
                    <vyskyt>sever</vyskyt>
                    <min_pocet_jedincu>3</min_pocet_jedincu>
                    <min_uroven_nepritele>4</min_uroven_nepritele>
                    <min_typ_odmeny>střední</min_typ_odmeny>
                </skupina_nepratel>
                <skupina_nepratel n_nazev="Potulná zvěř">
                    <vyskyt>celá oblast</vyskyt>
                    <min_pocet_jedincu>1</min_pocet_jedincu>
                    <min_uroven_nepritele>1</min_uroven_nepritele>
                    <min_typ_odmeny>normální</min_typ_odmeny>
                </skupina_nepratel>
            </skupiny_nepratel>
            <hlavni_nepratele>
                <hlavni_nepritel id="1" jmeno="Borgah" trida="válečník">
                    <level>9</level>
                    <pozice>
                        <x>100</x>
                        <y>20</y>
                        <z>50</z>
                    </pozice>
                    <dohled>12</dohled>
                    <staty>
                        <zivoty rychlot_obnovy_zivotu="0.2">150</zivoty>
                        <pohyblivost rychlost_obnovy_pohyblivosti="0.5">70</pohyblivost>
                        <rychlost_utoku>0.2</rychlost_utoku>
                    </staty>
                    <zvlastni_schpnost zbran="žádná">vrh balvanem</zvlastni_schpnost>
                    <typ_odmeny xp="250">normální</typ_odmeny>
                </hlavni_nepritel>
                <hlavni_nepritel id="2" jmeno="Daurelis" trida="černokněžník">
                    <level>10</level>
                    <pozice>
                        <x>25</x>
                        <y>325</y>
                        <z>45</z>
                    </pozice>
                    <dohled>19</dohled>
                    <staty>
                        <zivoty rychlot_obnovy_zivotu="0.5">200</zivoty>
                        <pohyblivost rychlost_obnovy_pohyblivosti="0.5">85</pohyblivost>
                        <rychlost_utoku>0.2</rychlost_utoku>
                    </staty>
                    <zvlastni_schpnost zbran="temná magická hůl">ledový hrot</zvlastni_schpnost>
                    <typ_odmeny xp="300">střední</typ_odmeny>
                </hlavni_nepritel>
            </hlavni_nepratele>
            <poklady>
                <poklad id="250">
                    <pozice>
                        <x>0</x>
                        <y>200</y>
                        <z>25</z>
                    </pozice>
                    <typ_odmeny xp="20">střední</typ_odmeny>
                </poklad>
                <poklad id="251">
                    <pozice>
                        <x>348</x>
                        <y>526</y>
                        <z>40</z>
                    </pozice>
                    <typ_odmeny xp="50">vzácná</typ_odmeny>
                </poklad>
                <poklad id="252">
                    <pozice>
                        <x>250</x>
                        <y>654</y>
                        <z>60</z>
                    </pozice>
                    <typ_odmeny xp="50">vzácná</typ_odmeny>
                </poklad>
            </poklady>
            <souboje>
                <pvp>false</pvp>
                <arena>true</arena>
                <potrebna_reputace>nenáviděn</potrebna_reputace>
            </souboje>
        </oblast>
        <oblast id="2" o_nazev="Nejčarovnější les">
            <nastaveni>
                <filtr>tmavý</filtr>
                <viditelnost>40</viditelnost>
                <pocasi obloha="slunce">polojasno</pocasi>
                <rozloha>600</rozloha>
                <hudba_playlist>6</hudba_playlist>
                <voda>
                    <odstin>2</odstin>
                    <odraz>false</odraz>
                    <kvalita>střední</kvalita>
                </voda>
            </nastaveni>
            <urovne>
                <min_uroven>10</min_uroven>
                <min_uroven_nepratel>10</min_uroven_nepratel>
                <max_uroven_nepratel>20</max_uroven_nepratel>
            </urovne>
            <frakce_v_oblasti>
                <frakce f_nazev="Elfové">
                    <reputace body_na_zacatek="0">přátelé</reputace>
                    <zamereni>lučištníci</zamereni>
                    <interaktivni_postavy>
                        <interaktivni_postava id="7" jmeno="Mirime">
                            <moznost_zabit>false</moznost_zabit>
                            <ukoly>
                                <ukol id="4" u_nazev="Jasnovidec">
                                    <popis>Zjisti, kdo škodí elfům v jejich lesním domově.</popis>
                                    <odmena>Toulec a deset šípů s železným hrotem</odmena>
                                </ukol>
                            </ukoly>
                        </interaktivni_postava>
                    </interaktivni_postavy>
                </frakce>
                <frakce f_nazev="Dryády">
                    <reputace body_na_zacatek="500">neutrální</reputace>
                    <zamereni>léčitelé</zamereni>
                    <interaktivni_postavy>
                        <interaktivni_postava id="8" jmeno="Laticia">
                            <moznost_zabit>false</moznost_zabit>
                            <ukoly>
                                <ukol id="5" u_nazev="Kouzlo lesa">
                                    <popis>Prozkoumej ještě nikým neprobádané jižní části lesa. Dej si však velký pozor. Proslýchá se, že tam žije nevídané.</popis>
                                    <odmena>Pět zlatých</odmena>
                                </ukol>
                            </ukoly>
                        </interaktivni_postava>
                    </interaktivni_postavy>
                </frakce>
            </frakce_v_oblasti>
            <skupiny_nepratel>
                <skupina_nepratel n_nazev="Jezdci">
                    <vyskyt>východ</vyskyt>
                    <min_pocet_jedincu>5</min_pocet_jedincu>
                    <min_uroven_nepritele>13</min_uroven_nepritele>
                    <min_typ_odmeny>vzácná</min_typ_odmeny>
                </skupina_nepratel>
                <skupina_nepratel n_nazev="Lesní zvěř">
                    <vyskyt>celá oblast</vyskyt>
                    <min_pocet_jedincu>1</min_pocet_jedincu>
                    <min_uroven_nepritele>10</min_uroven_nepritele>
                    <min_typ_odmeny>střední</min_typ_odmeny>
                </skupina_nepratel>
                <skupina_nepratel n_nazev="Zbojníci">
                    <vyskyt>celá oblast</vyskyt>
                    <min_pocet_jedincu>2</min_pocet_jedincu>
                    <min_uroven_nepritele>10</min_uroven_nepritele>
                    <min_typ_odmeny>střední</min_typ_odmeny>
                </skupina_nepratel>
                <skupina_nepratel n_nazev="Zelení goblini">
                    <vyskyt>jih</vyskyt>
                    <min_pocet_jedincu>3</min_pocet_jedincu>